{"contract_id": "experiment-evaluation", "contract_version": "1.0.0", "drift": {"available": false, "compared_metrics": [], "drift_count": 0, "worst_metric": null}, "evidence_refs": ["aaaaaaaaaaaaaaaaaaaaaaaaaaaaaaaaaaaaaaaaaaaaaaaaaaaaaaaaaaaaaaaa", "ledger-quality:unknown"], "experiment_id": "d530ca59d5246bee", "promotion": {"blockers": [], "rationale": "未提供基线冠军报告，无法对比漂移；实验保持研究提案。", "recommendation": "hold"}, "reference_time": "2026-01-05T00:00:00+00:00", "report_sha256": "6d42d4e630509d52fb7310022e8cfa703bf7f837b46999ba34c2d5f824e79326", "robustness": {"basis": "period_returns", "max_drawdown": -0.05, "notes": ["基于 4 个逐期收益计算稳健性。"], "overall": "stable", "period_return_stability": 0.6, "positive_period_ratio": 0.75, "score": 0.7175, "volatility": 0.1}, "snapshot_sha256": "aaaaaaaaaaaaaaaaaaaaaaaaaaaaaaaaaaaaaaaaaaaaaaaaaaaaaaaaaaaaaaaa", "status": "proposed", "strategy_key": "cw3-strategy", "strategy_version": "1.0.0", "summary": {"baseline_included": false, "recommendation": "hold", "report_sha256": "6d42d4e630509d52fb7310022e8cfa703bf7f837b46999ba34c2d5f824e79326", "truncated": false}}